{
  "schema": "dusk.enrollments/v1",
  "id": "01a112fe-d1bb-72ae-b6bf-fee320d65964",
  "time": "2026-10-06T09:14:05.512408122Z",
  "operation": "enroll",
  "outcome": "issued",
  "reason": null,
  "device_id": "7c1a5e9f3b2d4a6e8f0c1b3d5e7a9c2f",
  "installation_id": "0e8d6c4b2a1f3e5d7c9b8a6f4e2d1c3b",
  "tenant": null,
  "credential_kind": "install_token",
  "credential_ref": "factory-line-2",
  "credential_issuer": "factory-2026",
  "hardware_fingerprint_hash": "c2e4a6b8d0f1e3c5a7b9d1f3e5c7a9b0d2f4e6c8a1b3d5f7e9c0a2b4d6f8e1c3",
  "remote_address": "[2001:db8:4::17]:40110",
  "cert_serial": "1a2b3c4d5e6f708192a3b4c5d6e7f809",
  "cert_fingerprint": "d4b6f8a0c2e4f6a8b0d2c4e6f8a1b3d5c7e9f1a3b5d7c9e1f3a5b7d9c1e3f5a7",
  "cert_not_after": "2026-10-13T09:14:02.000000000Z",
  "dusk_version": "0.1.0",
  "impl": "nix",
  "target_os": "linux",
  "target_arch": "aarch64",
  "hostname": "pos-17",
  "instance": "nightfall-0"
}
