{
  "schema": "dusk.enrollments/v1",
  "id": "01a112fe-d1bb-72ae-b6bf-fee2a3b73e15",
  "time": "2026-10-06T09:14:02.512408119Z",
  "operation": "enroll",
  "outcome": "issued",
  "reason": null,
  "device_id": "7c2e9a4f1b6d3e8a0c5f2b9d4e1a6c38",
  "installation_id": "e81b4d6a2f9c3e7b0a5d8c1f4b2e9a63",
  "tenant": "retail-eu",
  "credential_kind": "provision_token",
  "credential_ref": "retail-eu-2026-10",
  "credential_issuer": null,
  "hardware_fingerprint_hash": "c2e4a6b8d0f1e3c5a7b9d1f3e5c7a9b0d2f4e6c8a1b3d5f7e9c0a2b4d6f8e1c3",
  "remote_address": "203.0.113.24:51730",
  "cert_serial": "4f1c0e9a2b7d3e5f8a6c1b0d9e2f7a43",
  "cert_fingerprint": "9b2f4c8e1a7d3b6f0e5c9a2d8b4f1e7c3a6d0b9e2f5c8a1d4b7e0f3c6a9d2b5e",
  "cert_not_after": "2026-10-13T09:14:02.000000000Z",
  "dusk_version": "0.1.0",
  "impl": "nix",
  "target_os": "linux",
  "target_arch": "x86_64",
  "hostname": "kiosk-0107",
  "instance": "nightfall-0"
}
