{
  "schema": "dusk.enrollments/v1",
  "id": "01a112fe-d1bb-72ae-b6bf-fee3a1c0d7e4",
  "time": "2026-10-06T09:14:06.512408122Z",
  "operation": "assign",
  "outcome": "denied",
  "reason": "credential_quota_reached",
  "device_id": "7c1a5e9f3b2d4a6e8f0c1b3d5e7a9c2f",
  "installation_id": null,
  "tenant": null,
  "credential_kind": "install_token",
  "credential_ref": "factory-line-3",
  "credential_issuer": "factory-2026",
  "hardware_fingerprint_hash": "c2e4a6b8d0f1e3c5a7b9d1f3e5c7a9b0d2f4e6c8a1b3d5f7e9c0a2b4d6f8e1c3",
  "remote_address": "[2001:db8:4::17]:40110",
  "cert_serial": null,
  "cert_fingerprint": null,
  "cert_not_after": null,
  "dusk_version": "0.1.0",
  "impl": "nix",
  "target_os": "linux",
  "target_arch": "aarch64",
  "hostname": "pos-17",
  "instance": "nightfall-0"
}
